{
  "include": [
    "src/features/extract/**/*.ts",
    "src/platform/infra/git/**/*.ts",
    "src/features/builder/**/*.ts",
    "src/features/query/**/*.ts",
    "src/platform/infra/cli-presentation/**/*.ts",
    "src/platform/infra/extraction-config/**/*.ts",
    "src/platform/infra/graph-persistence/**/*.ts",
    "src/platform/infra/source-filtering/**/*.ts",
    "src/platform/infra/component-mapping/**/*.ts",
    "src/platform/infra/errors/**/*.ts",
    "src/platform/domain/**/*.ts",
    "src/shell/**/*.ts"
  ],
  "roleDefinitionsDir": "role-definitions",
  "ignorePatterns": ["**/*.spec.ts", "**/__fixtures__/**"],
  "layers": {
    "entrypoint": {
      "paths": ["src/features/entrypoint", "src/features/builder/entrypoint", "src/features/query/entrypoint"],
      "allowedRoles": ["cli-entrypoint"]
    },
    "commands": {
      "paths": ["src/features/commands", "src/features/builder/commands"],
      "allowedRoles": ["command-use-case", "command-use-case-input", "command-use-case-result", "command-input-factory"]
    },
    "queries": {
      "paths": ["src/features/builder/queries"],
      "allowedRoles": ["domain-service", "value-object"]
    },
    "domain": {
      "paths": ["src/features,platform/domain"],
      "allowedRoles": ["aggregate", "value-object", "domain-service"]
    },
    "cli-output": {
      "paths": ["src/features/infra/cli/output"],
      "allowedRoles": ["cli-output-formatter"]
    },
    "external-clients": {
      "paths": ["src/features,platform/infra/external-clients", "src/platform/infra/git"],
      "allowedRoles": ["external-client-service", "external-client-model", "external-client-error"]
    },
    "persistence": {
      "paths": ["src/features/infra/persistence"],
      "allowedRoles": ["aggregate-repository"]
    },
    "cli-presentation": {
      "paths": ["src/platform/infra/cli-presentation"],
      "allowedRoles": ["cli-output-formatter", "cli-input-validator", "command-input-factory", "value-object", "cli-error"]
    },
    "platform-infra-external-clients": {
      "paths": [
        "src/platform/infra/extraction-config",
        "src/platform/infra/graph-persistence",
        "src/platform/infra/source-filtering",
        "src/platform/infra/component-mapping",
        "src/platform/infra/errors"
      ],
      "allowedRoles": ["external-client-service", "external-client-model", "external-client-error", "command-input-factory", "command-use-case-input"]
    },
    "platform-domain": {
      "paths": ["src/platform/domain"],
      "allowedRoles": ["value-object", "domain-service"]
    },
    "shell": {
      "paths": ["src/shell"],
      "allowedRoles": ["cli-entrypoint", "command-input-factory"]
    }
  },
  "roles": [
    {
      "name": "cli-entrypoint",
      "targets": ["function"]
    },
    {
      "name": "command-use-case",
      "targets": ["function"],
      "allowedInputs": ["command-use-case-input"],
      "forbiddenDependencies": ["command-use-case"]
    },
    {
      "name": "command-use-case-input",
      "targets": ["interface", "type-alias"],
      "nameMatches": ".*Input$"
    },
    {
      "name": "command-use-case-result",
      "targets": ["interface", "type-alias"],
      "nameMatches": ".*Result$"
    },
    {
      "name": "cli-output-formatter",
      "targets": ["function"]
    },
    {
      "name": "command-input-factory",
      "targets": ["function"]
    },
    {
      "name": "external-client-service",
      "targets": ["function"]
    },
    {
      "name": "aggregate-repository",
      "targets": ["class"]
    },
    {
      "name": "aggregate",
      "targets": ["interface", "type-alias", "class"]
    },
    {
      "name": "value-object",
      "targets": ["interface", "type-alias", "class"]
    },
    {
      "name": "domain-service",
      "targets": ["function"]
    },
    {
      "name": "external-client-model",
      "targets": ["interface", "type-alias", "class"]
    },
    {
      "name": "external-client-error",
      "targets": ["class"]
    },
    {
      "name": "cli-input-validator",
      "targets": ["function"]
    },
    {
      "name": "cli-error",
      "targets": ["class"]
    }
  ]
}
